{
  "$schema": "http://json-schema.org/draft-07/schema#",
  "$id": "https://github.com/mcallbosco/vlviewer-icon-packs/schemas/pack.schema.json",
  "title": "VLViewer Icon Pack",
  "type": "object",
  "required": ["id", "game", "label", "familyId", "license", "credits"],
  "additionalProperties": false,
  "properties": {
    "$schema": { "type": "string" },
    "id": {
      "type": "string",
      "pattern": "^[a-z0-9][a-z0-9-]{0,31}$",
      "description": "Unique pack id, kebab-case, max 32 chars."
    },
    "game": {
      "type": "string",
      "enum": ["deadlock"]
    },
    "label": {
      "type": "string",
      "minLength": 1,
      "maxLength": 64
    },
    "familyId": {
      "type": "string",
      "enum": ["official", "event", "community"]
    },
    "description": { "type": "string", "maxLength": 500 },
    "license": {
      "type": "string",
      "minLength": 1,
      "description": "Asset license declared by the pack contributor."
    },
    "hidden": {
      "type": "boolean",
      "description": "When true, the pack is only shown in the site UI if an active event references it or the user already selected it.",
      "default": false
    },
    "credits": {
      "type": "array",
      "minItems": 1,
      "items": {
        "type": "object",
        "required": ["name"],
        "additionalProperties": false,
        "properties": {
          "name": { "type": "string", "minLength": 1 },
          "role": { "type": "string" },
          "url": { "type": "string", "format": "uri" }
        }
      }
    },
    "vpk": {
      "type": "string",
      "pattern": "\\.(vpk|zip)$",
      "description": "Relative path to the VPK inside this pack folder. May be a plain .vpk or a .zip containing exactly one .vpk. Zipping is strongly preferred; raw VPKs over 100 MB cannot be pushed to GitHub."
    },
    "vpkSources": {
      "type": "object",
      "minProperties": 1,
      "propertyNames": { "pattern": "^[a-z0-9][a-z0-9-]{0,31}$" },
      "additionalProperties": {
        "type": "string",
        "pattern": "\\.(vpk|zip)$"
      },
      "description": "Named VPK inputs for packs that combine multiple archives. extraction.variants entries select a source by id."
    },
    "extraction": {
      "type": "object",
      "additionalProperties": false,
      "properties": {
        "filePathFilter": {
          "type": "string",
          "default": "panorama/images/heroes/"
        },
        "variants": {
          "type": "object",
          "minProperties": 1,
          "additionalProperties": false,
          "patternProperties": {
            "^[a-z0-9][a-z0-9-]{0,31}$": { "$ref": "#/definitions/variantExtraction" }
          }
        }
      }
    },
    "variantLabels": {
      "type": "object",
      "propertyNames": { "pattern": "^[a-z0-9][a-z0-9-]{0,31}$" },
      "additionalProperties": { "type": "string", "minLength": 1, "maxLength": 64 },
      "description": "Optional user-facing labels for built-in or custom variant ids."
    },
    "iconOverridesDir": {
      "type": "string",
      "default": "icons-extra",
      "description": "Folder containing per-variant PNG overrides. Layout: <dir>/<variant>/<character>.png."
    },
    "doNotUse": {
      "type": "array",
      "uniqueItems": true,
      "items": {
        "type": "string",
        "pattern": "^[a-z0-9][a-z0-9-]{0,31}$"
      },
      "description": "Variants this pack ships but should not be used by the website (e.g. a fan pack that only has art for some surfaces). Listed variants are dropped during extraction and excluded from the generated manifest."
    },
    "excludeIcons": {
      "type": "array",
      "uniqueItems": true,
      "items": {
        "type": "string",
        "pattern": "^[a-z0-9][a-z0-9-]{0,31}/[a-z0-9][a-z0-9._-]*\\.png$"
      },
      "description": "Per-icon exclusions as variant/character.png (e.g. normal/nano.png). Matched case-insensitively, dropped during extraction, and omitted from the generated manifest. Missing files are ignored."
    }
  },
  "definitions": {
    "variantExtraction": {
      "type": "object",
      "additionalProperties": false,
      "oneOf": [
        { "required": ["suffix"] },
        { "required": ["suffixes"] }
      ],
      "properties": {
        "source": {
          "type": "string",
          "pattern": "^[a-z0-9][a-z0-9-]{0,31}$",
          "description": "Named vpkSources entry. Required when a pack declares more than one VPK input."
        },
        "suffix": {
          "type": "string",
          "pattern": "^_[a-z0-9_]+$",
          "description": "File suffix (without extension) matched in the VPK, e.g. '_card_psd'."
        },
        "suffixes": {
          "type": "array",
          "minItems": 1,
          "uniqueItems": true,
          "items": {
            "type": "string",
            "pattern": "^_[a-z0-9_]+$"
          },
          "description": "Ordered file suffixes matched in the VPK. Earlier entries win when multiple files resolve to one character."
        }
      }
    }
  },
  "allOf": [
    {
      "anyOf": [
        { "required": ["vpk"] },
        { "required": ["vpkSources"] },
        {
          "properties": {
            "iconOverridesDir": { "type": "string", "minLength": 1 }
          }
        }
      ]
    }
  ]
}
