{
  "$schema": "../../../schemas/pack.schema.json",
  "id": "robo-portraits",
  "game": "deadlock",
  "label": "Robo's Deadlock Portraits",
  "familyId": "community",
  "description": "Robo's illustrated Deadlock portraits, with default-color and monochrome variants.",
  "license": "No license specified by the author.",
  "credits": [
    {
      "name": "Robo The God",
      "role": "Artist/Director",
      "url": "https://gamebanana.com/members/1828146"
    },
    {
      "name": "cosmiclatte",
      "role": "Compiler/Developer",
      "url": "https://gamebanana.com/members/1529951"
    },
    {
      "name": "Wavy",
      "role": "Special Thanks"
    },
    {
      "name": "GooB",
      "role": "Special Thanks"
    },
    {
      "name": "Tired Bread",
      "role": "Special Thanks"
    },
    {
      "name": "Baiwar72",
      "role": "Special Thanks"
    },
    {
      "name": "SimplySerdna",
      "role": "Special Thanks"
    },
    {
      "name": "doodoocacaballsdick",
      "role": "Special Thanks",
      "url": "https://gamebanana.com/members/2407148"
    }
  ],
  "vpkSources": {
    "default": "default_portraits_v3.zip",
    "monochrome": "monochrome_portraits_v3.zip"
  },
  "extraction": {
    "variants": {
      "normal": {
        "source": "default",
        "suffix": "_card_psd"
      },
      "normal-monochrome": {
        "source": "monochrome",
        "suffix": "_card_psd"
      }
    }
  },
  "variantLabels": {
    "normal": "Normal",
    "normal-monochrome": "Normal Monochrome"
  }
}
