{
  "$schema": "../../../schemas/pack.schema.json",
  "id": "catlock",
  "game": "deadlock",
  "label": "Catlock",
  "familyId": "community",
  "description": "Cat-themed portraits.",
  "license": "Creative Commons Attribution-NonCommercial-NoDerivatives 4.0 International (CC BY-NC-ND 4.0).",
  "doNotUse": ["minimap"],
  "credits": [
    {
      "name": "Die Chance",
      "role": "Artist",
      "url": "https://gamebanana.com/mods/656526"
    },
    {
      "name": "duckenjoyer69",
      "role": "Mod developer",
      "url": "https://gamebanana.com/mods/656526"
    }
  ],
  "vpk": "pack.vpk.zip"
}
